No.     Time           Source                Destination           Protocol Length Info
    623 5.732416000    192.168.0.70          162.243.250.215       HTTP     563    GET /site/wallet_results?address=mR1nCRjw9nJBnkwEnE33UpjsrEQTyEb7w2 HTTP/1.1 

Frame 623: 563 bytes on wire (4504 bits), 563 bytes captured (4504 bits) on interface 0
    Interface id: 0
    Encapsulation type: Ethernet (1)
    Arrival Time: Feb 17, 2014 16:08:22.905298000 E. South America Standard Time
    [Time shift for this packet: 0.000000000 seconds]
    Epoch Time: 1392664102.905298000 seconds
    [Time delta from previous captured frame: 0.002951000 seconds]
    [Time delta from previous displayed frame: 0.000000000 seconds]
    [Time since reference or first frame: 5.732416000 seconds]
    Frame Number: 623
    Frame Length: 563 bytes (4504 bits)
    Capture Length: 563 bytes (4504 bits)
    [Frame is marked: False]
    [Frame is ignored: False]
    [Protocols in frame: eth:ip:tcp:http]
    [Number of per-protocol-data: 1]
    [Hypertext Transfer Protocol, key 0]
    [Coloring Rule Name: HTTP]
    [Coloring Rule String: http || tcp.port == 80]
Ethernet II, Src: Azurewav_69:57:2a (dc:85:de:69:57:2a), Dst: Tp-LinkT_d9:d4:14 (64:66:b3:d9:d4:14)
    Destination: Tp-LinkT_d9:d4:14 (64:66:b3:d9:d4:14)
        Address: Tp-LinkT_d9:d4:14 (64:66:b3:d9:d4:14)
        .... ..0. .... .... .... .... = LG bit: Globally unique address (factory default)
        .... ...0 .... .... .... .... = IG bit: Individual address (unicast)
    Source: Azurewav_69:57:2a (dc:85:de:69:57:2a)
        Address: Azurewav_69:57:2a (dc:85:de:69:57:2a)
        .... ..0. .... .... .... .... = LG bit: Globally unique address (factory default)
        .... ...0 .... .... .... .... = IG bit: Individual address (unicast)
    Type: IP (0x0800)
Internet Protocol Version 4, Src: 192.168.0.70 (192.168.0.70), Dst: 162.243.250.215 (162.243.250.215)
    Version: 4
    Header length: 20 bytes
    Differentiated Services Field: 0x00 (DSCP 0x00: Default; ECN: 0x00: Not-ECT (Not ECN-Capable Transport))
        0000 00.. = Differentiated Services Codepoint: Default (0x00)
        .... ..00 = Explicit Congestion Notification: Not-ECT (Not ECN-Capable Transport) (0x00)
    Total Length: 549
    Identification: 0x5b74 (23412)
    Flags: 0x02 (Don't Fragment)
        0... .... = Reserved bit: Not set
        .1.. .... = Don't fragment: Set
        ..0. .... = More fragments: Not set
    Fragment offset: 0
    Time to live: 128
    Protocol: TCP (6)
    Header checksum: 0x3ea5 [correct]
        [Good: True]
        [Bad: False]
    Source: 192.168.0.70 (192.168.0.70)
    Destination: 162.243.250.215 (162.243.250.215)
    [Source GeoIP: Unknown]
    [Destination GeoIP: Unknown]
Transmission Control Protocol, Src Port: 51803 (51803), Dst Port: http (80), Seq: 1, Ack: 1, Len: 509
    Source port: 51803 (51803)
    Destination port: http (80)
    [Stream index: 27]
    Sequence number: 1    (relative sequence number)
    [Next sequence number: 510    (relative sequence number)]
    Acknowledgment number: 1    (relative ack number)
    Header length: 20 bytes
    Flags: 0x018 (PSH, ACK)
        000. .... .... = Reserved: Not set
        ...0 .... .... = Nonce: Not set
        .... 0... .... = Congestion Window Reduced (CWR): Not set
        .... .0.. .... = ECN-Echo: Not set
        .... ..0. .... = Urgent: Not set
        .... ...1 .... = Acknowledgment: Set
        .... .... 1... = Push: Set
        .... .... .0.. = Reset: Not set
        .... .... ..0. = Syn: Not set
        .... .... ...0 = Fin: Not set
    Window size value: 4154
    [Calculated window size: 16616]
    [Window size scaling factor: 4]
    Checksum: 0x90c0 [validation disabled]
        [Good Checksum: False]
        [Bad Checksum: False]
    [SEQ/ACK analysis]
        [Bytes in flight: 509]
Hypertext Transfer Protocol
    GET /site/wallet_results?address=mR1nCRjw9nJBnkwEnE33UpjsrEQTyEb7w2 HTTP/1.1\r\n
        [Expert Info (Chat/Sequence): GET /site/wallet_results?address=mR1nCRjw9nJBnkwEnE33UpjsrEQTyEb7w2 HTTP/1.1\r\n]
            [Message: GET /site/wallet_results?address=mR1nCRjw9nJBnkwEnE33UpjsrEQTyEb7w2 HTTP/1.1\r\n]
            [Severity level: Chat]
            [Group: Sequence]
        Request Method: GET
        Request URI: /site/wallet_results?address=mR1nCRjw9nJBnkwEnE33UpjsrEQTyEb7w2
        Request Version: HTTP/1.1
    Host: yaamp.com\r\n
    Connection: keep-alive\r\n
    Accept: */*\r\n
    X-Requested-With: XMLHttpRequest\r\n
    User-Agent: Mozilla/5.0 (Windows NT 6.3; WOW64) AppleWebKit/537.36 (KHTML, like Gecko) Chrome/32.0.1700.107 Safari/537.36\r\n
    Referer: http://yaamp.com/site/wallet?address=mR1nCRjw9nJBnkwEnE33UpjsrEQTyEb7w2\r\n
    Accept-Encoding: gzip,deflate,sdch\r\n
    Accept-Language: pt-BR,pt;q=0.8,en-US;q=0.6,en;q=0.4\r\n
    Cookie: PHPSESSID=us1sp67uk08cbudm4vjpb76bv1\r\n
    \r\n
    [Full request URI: http://yaamp.com/site/wallet_results?address=mR1nCRjw9nJBnkwEnE33UpjsrEQTyEb7w2]
    [HTTP request 1/2]
    [Response in frame: 689]
    [Next request in frame: 1132]

No.     Time           Source                Destination           Protocol Length Info
   1132 8.426662000    192.168.0.70          162.243.250.215       HTTP     563    GET /site/wallet_results?address=mST3g51yq9pUqTNY2mswaqqUE758Lo5Qen HTTP/1.1 

Frame 1132: 563 bytes on wire (4504 bits), 563 bytes captured (4504 bits) on interface 0
    Interface id: 0
    Encapsulation type: Ethernet (1)
    Arrival Time: Feb 17, 2014 16:08:25.599544000 E. South America Standard Time
    [Time shift for this packet: 0.000000000 seconds]
    Epoch Time: 1392664105.599544000 seconds
    [Time delta from previous captured frame: 0.006876000 seconds]
    [Time delta from previous displayed frame: 2.694246000 seconds]
    [Time since reference or first frame: 8.426662000 seconds]
    Frame Number: 1132
    Frame Length: 563 bytes (4504 bits)
    Capture Length: 563 bytes (4504 bits)
    [Frame is marked: False]
    [Frame is ignored: False]
    [Protocols in frame: eth:ip:tcp:http]
    [Number of per-protocol-data: 1]
    [Hypertext Transfer Protocol, key 0]
    [Coloring Rule Name: HTTP]
    [Coloring Rule String: http || tcp.port == 80]
Ethernet II, Src: Azurewav_69:57:2a (dc:85:de:69:57:2a), Dst: Tp-LinkT_d9:d4:14 (64:66:b3:d9:d4:14)
    Destination: Tp-LinkT_d9:d4:14 (64:66:b3:d9:d4:14)
        Address: Tp-LinkT_d9:d4:14 (64:66:b3:d9:d4:14)
        .... ..0. .... .... .... .... = LG bit: Globally unique address (factory default)
        .... ...0 .... .... .... .... = IG bit: Individual address (unicast)
    Source: Azurewav_69:57:2a (dc:85:de:69:57:2a)
        Address: Azurewav_69:57:2a (dc:85:de:69:57:2a)
        .... ..0. .... .... .... .... = LG bit: Globally unique address (factory default)
        .... ...0 .... .... .... .... = IG bit: Individual address (unicast)
    Type: IP (0x0800)
Internet Protocol Version 4, Src: 192.168.0.70 (192.168.0.70), Dst: 162.243.250.215 (162.243.250.215)
    Version: 4
    Header length: 20 bytes
    Differentiated Services Field: 0x00 (DSCP 0x00: Default; ECN: 0x00: Not-ECT (Not ECN-Capable Transport))
        0000 00.. = Differentiated Services Codepoint: Default (0x00)
        .... ..00 = Explicit Congestion Notification: Not-ECT (Not ECN-Capable Transport) (0x00)
    Total Length: 549
    Identification: 0x5b78 (23416)
    Flags: 0x02 (Don't Fragment)
        0... .... = Reserved bit: Not set
        .1.. .... = Don't fragment: Set
        ..0. .... = More fragments: Not set
    Fragment offset: 0
    Time to live: 128
    Protocol: TCP (6)
    Header checksum: 0x3ea1 [correct]
        [Good: True]
        [Bad: False]
    Source: 192.168.0.70 (192.168.0.70)
    Destination: 162.243.250.215 (162.243.250.215)
    [Source GeoIP: Unknown]
    [Destination GeoIP: Unknown]
Transmission Control Protocol, Src Port: 51803 (51803), Dst Port: http (80), Seq: 510, Ack: 557, Len: 509
    Source port: 51803 (51803)
    Destination port: http (80)
    [Stream index: 27]
    Sequence number: 510    (relative sequence number)
    [Next sequence number: 1019    (relative sequence number)]
    Acknowledgment number: 557    (relative ack number)
    Header length: 20 bytes
    Flags: 0x018 (PSH, ACK)
        000. .... .... = Reserved: Not set
        ...0 .... .... = Nonce: Not set
        .... 0... .... = Congestion Window Reduced (CWR): Not set
        .... .0.. .... = ECN-Echo: Not set
        .... ..0. .... = Urgent: Not set
        .... ...1 .... = Acknowledgment: Set
        .... .... 1... = Push: Set
        .... .... .0.. = Reset: Not set
        .... .... ..0. = Syn: Not set
        .... .... ...0 = Fin: Not set
    Window size value: 4015
    [Calculated window size: 16060]
    [Window size scaling factor: 4]
    Checksum: 0x37d2 [validation disabled]
        [Good Checksum: False]
        [Bad Checksum: False]
    [SEQ/ACK analysis]
        [Bytes in flight: 509]
Hypertext Transfer Protocol
    GET /site/wallet_results?address=mST3g51yq9pUqTNY2mswaqqUE758Lo5Qen HTTP/1.1\r\n
        [Expert Info (Chat/Sequence): GET /site/wallet_results?address=mST3g51yq9pUqTNY2mswaqqUE758Lo5Qen HTTP/1.1\r\n]
            [Message: GET /site/wallet_results?address=mST3g51yq9pUqTNY2mswaqqUE758Lo5Qen HTTP/1.1\r\n]
            [Severity level: Chat]
            [Group: Sequence]
        Request Method: GET
        Request URI: /site/wallet_results?address=mST3g51yq9pUqTNY2mswaqqUE758Lo5Qen
        Request Version: HTTP/1.1
    Host: yaamp.com\r\n
    Connection: keep-alive\r\n
    Accept: */*\r\n
    X-Requested-With: XMLHttpRequest\r\n
    User-Agent: Mozilla/5.0 (Windows NT 6.3; WOW64) AppleWebKit/537.36 (KHTML, like Gecko) Chrome/32.0.1700.107 Safari/537.36\r\n
    Referer: http://yaamp.com/site/wallet?address=mST3g51yq9pUqTNY2mswaqqUE758Lo5Qen\r\n
    Accept-Encoding: gzip,deflate,sdch\r\n
    Accept-Language: pt-BR,pt;q=0.8,en-US;q=0.6,en;q=0.4\r\n
    Cookie: PHPSESSID=us1sp67uk08cbudm4vjpb76bv1\r\n
    \r\n
    [Full request URI: http://yaamp.com/site/wallet_results?address=mST3g51yq9pUqTNY2mswaqqUE758Lo5Qen]
    [HTTP request 2/2]
    [Prev request in frame: 623]
    [Response in frame: 1210]

No.     Time           Source                Destination           Protocol Length Info
   1174 8.765836000    192.168.0.70          174.36.55.199         HTTP     746    GET /show/futures-in-biotech HTTP/1.1 

Frame 1174: 746 bytes on wire (5968 bits), 746 bytes captured (5968 bits) on interface 0
    Interface id: 0
    Encapsulation type: Ethernet (1)
    Arrival Time: Feb 17, 2014 16:08:25.938718000 E. South America Standard Time
    [Time shift for this packet: 0.000000000 seconds]
    Epoch Time: 1392664105.938718000 seconds
    [Time delta from previous captured frame: 0.002830000 seconds]
    [Time delta from previous displayed frame: 0.339174000 seconds]
    [Time since reference or first frame: 8.765836000 seconds]
    Frame Number: 1174
    Frame Length: 746 bytes (5968 bits)
    Capture Length: 746 bytes (5968 bits)
    [Frame is marked: False]
    [Frame is ignored: False]
    [Protocols in frame: eth:ip:tcp:http]
    [Number of per-protocol-data: 1]
    [Hypertext Transfer Protocol, key 0]
    [Coloring Rule Name: HTTP]
    [Coloring Rule String: http || tcp.port == 80]
Ethernet II, Src: Azurewav_69:57:2a (dc:85:de:69:57:2a), Dst: Tp-LinkT_d9:d4:14 (64:66:b3:d9:d4:14)
    Destination: Tp-LinkT_d9:d4:14 (64:66:b3:d9:d4:14)
        Address: Tp-LinkT_d9:d4:14 (64:66:b3:d9:d4:14)
        .... ..0. .... .... .... .... = LG bit: Globally unique address (factory default)
        .... ...0 .... .... .... .... = IG bit: Individual address (unicast)
    Source: Azurewav_69:57:2a (dc:85:de:69:57:2a)
        Address: Azurewav_69:57:2a (dc:85:de:69:57:2a)
        .... ..0. .... .... .... .... = LG bit: Globally unique address (factory default)
        .... ...0 .... .... .... .... = IG bit: Individual address (unicast)
    Type: IP (0x0800)
Internet Protocol Version 4, Src: 192.168.0.70 (192.168.0.70), Dst: 174.36.55.199 (174.36.55.199)
    Version: 4
    Header length: 20 bytes
    Differentiated Services Field: 0x00 (DSCP 0x00: Default; ECN: 0x00: Not-ECT (Not ECN-Capable Transport))
        0000 00.. = Differentiated Services Codepoint: Default (0x00)
        .... ..00 = Explicit Congestion Notification: Not-ECT (Not ECN-Capable Transport) (0x00)
    Total Length: 732
    Identification: 0x7e95 (32405)
    Flags: 0x02 (Don't Fragment)
        0... .... = Reserved bit: Not set
        .1.. .... = Don't fragment: Set
        ..0. .... = More fragments: Not set
    Fragment offset: 0
    Time to live: 128
    Protocol: TCP (6)
    Header checksum: 0xd2ac [correct]
        [Good: True]
        [Bad: False]
    Source: 192.168.0.70 (192.168.0.70)
    Destination: 174.36.55.199 (174.36.55.199)
    [Source GeoIP: Unknown]
    [Destination GeoIP: Unknown]
Transmission Control Protocol, Src Port: 51853 (51853), Dst Port: http (80), Seq: 1, Ack: 1, Len: 692
    Source port: 51853 (51853)
    Destination port: http (80)
    [Stream index: 55]
    Sequence number: 1    (relative sequence number)
    [Next sequence number: 693    (relative sequence number)]
    Acknowledgment number: 1    (relative ack number)
    Header length: 20 bytes
    Flags: 0x018 (PSH, ACK)
        000. .... .... = Reserved: Not set
        ...0 .... .... = Nonce: Not set
        .... 0... .... = Congestion Window Reduced (CWR): Not set
        .... .0.. .... = ECN-Echo: Not set
        .... ..0. .... = Urgent: Not set
        .... ...1 .... = Acknowledgment: Set
        .... .... 1... = Push: Set
        .... .... .0.. = Reset: Not set
        .... .... ..0. = Syn: Not set
        .... .... ...0 = Fin: Not set
    Window size value: 4154
    [Calculated window size: 16616]
    [Window size scaling factor: 4]
    Checksum: 0x024c [validation disabled]
        [Good Checksum: False]
        [Bad Checksum: False]
    [SEQ/ACK analysis]
        [Bytes in flight: 692]
Hypertext Transfer Protocol
    GET /show/futures-in-biotech HTTP/1.1\r\n
        [Expert Info (Chat/Sequence): GET /show/futures-in-biotech HTTP/1.1\r\n]
            [Message: GET /show/futures-in-biotech HTTP/1.1\r\n]
            [Severity level: Chat]
            [Group: Sequence]
        Request Method: GET
        Request URI: /show/futures-in-biotech
        Request Version: HTTP/1.1
    Host: twit.tv\r\n
    Connection: keep-alive\r\n
    Accept: text/html,application/xhtml+xml,application/xml;q=0.9,image/webp,*/*;q=0.8\r\n
    User-Agent: Mozilla/5.0 (Windows NT 6.3; WOW64) AppleWebKit/537.36 (KHTML, like Gecko) Chrome/32.0.1700.107 Safari/537.36\r\n
    Accept-Encoding: gzip,deflate,sdch\r\n
    Accept-Language: pt-BR,pt;q=0.8,en-US;q=0.6,en;q=0.4\r\n
    [truncated] Cookie: SESS75d408f2ce389493e4955f4b0d50c557=1cc24ok50gjr23jocea66i99k7; __qca=P0-1987247339-1392382357015; __utma=14346290.60775476.1392382360.1392382360.1392382360.1; __utmz=14346290.1392382360.1.1.utmcsr=(direct)|utmccn=(dir
    \r\n
    [Full request URI: http://twit.tv/show/futures-in-biotech]
    [HTTP request 1/1]
    [Response in frame: 1280]

No.     Time           Source                Destination           Protocol Length Info
   1311 9.953625000    192.168.0.70          174.36.55.199         HTTP     766    GET /files/css/css_ad23656066708bcd21f6033ea3dc2ba9.css HTTP/1.1 

Frame 1311: 766 bytes on wire (6128 bits), 766 bytes captured (6128 bits) on interface 0
    Interface id: 0
    Encapsulation type: Ethernet (1)
    Arrival Time: Feb 17, 2014 16:08:27.126507000 E. South America Standard Time
    [Time shift for this packet: 0.000000000 seconds]
    Epoch Time: 1392664107.126507000 seconds
    [Time delta from previous captured frame: 0.026266000 seconds]
    [Time delta from previous displayed frame: 1.187789000 seconds]
    [Time since reference or first frame: 9.953625000 seconds]
    Frame Number: 1311
    Frame Length: 766 bytes (6128 bits)
    Capture Length: 766 bytes (6128 bits)
    [Frame is marked: False]
    [Frame is ignored: False]
    [Protocols in frame: eth:ip:tcp:http]
    [Number of per-protocol-data: 1]
    [Hypertext Transfer Protocol, key 0]
    [Coloring Rule Name: HTTP]
    [Coloring Rule String: http || tcp.port == 80]
Ethernet II, Src: Azurewav_69:57:2a (dc:85:de:69:57:2a), Dst: Tp-LinkT_d9:d4:14 (64:66:b3:d9:d4:14)
    Destination: Tp-LinkT_d9:d4:14 (64:66:b3:d9:d4:14)
        Address: Tp-LinkT_d9:d4:14 (64:66:b3:d9:d4:14)
        .... ..0. .... .... .... .... = LG bit: Globally unique address (factory default)
        .... ...0 .... .... .... .... = IG bit: Individual address (unicast)
    Source: Azurewav_69:57:2a (dc:85:de:69:57:2a)
        Address: Azurewav_69:57:2a (dc:85:de:69:57:2a)
        .... ..0. .... .... .... .... = LG bit: Globally unique address (factory default)
        .... ...0 .... .... .... .... = IG bit: Individual address (unicast)
    Type: IP (0x0800)
Internet Protocol Version 4, Src: 192.168.0.70 (192.168.0.70), Dst: 174.36.55.199 (174.36.55.199)
    Version: 4
    Header length: 20 bytes
    Differentiated Services Field: 0x00 (DSCP 0x00: Default; ECN: 0x00: Not-ECT (Not ECN-Capable Transport))
        0000 00.. = Differentiated Services Codepoint: Default (0x00)
        .... ..00 = Explicit Congestion Notification: Not-ECT (Not ECN-Capable Transport) (0x00)
    Total Length: 752
    Identification: 0x7ea2 (32418)
    Flags: 0x02 (Don't Fragment)
        0... .... = Reserved bit: Not set
        .1.. .... = Don't fragment: Set
        ..0. .... = More fragments: Not set
    Fragment offset: 0
    Time to live: 128
    Protocol: TCP (6)
    Header checksum: 0xd28b [correct]
        [Good: True]
        [Bad: False]
    Source: 192.168.0.70 (192.168.0.70)
    Destination: 174.36.55.199 (174.36.55.199)
    [Source GeoIP: Unknown]
    [Destination GeoIP: Unknown]
Transmission Control Protocol, Src Port: 51858 (51858), Dst Port: http (80), Seq: 1, Ack: 1, Len: 712
    Source port: 51858 (51858)
    Destination port: http (80)
    [Stream index: 56]
    Sequence number: 1    (relative sequence number)
    [Next sequence number: 713    (relative sequence number)]
    Acknowledgment number: 1    (relative ack number)
    Header length: 20 bytes
    Flags: 0x018 (PSH, ACK)
        000. .... .... = Reserved: Not set
        ...0 .... .... = Nonce: Not set
        .... 0... .... = Congestion Window Reduced (CWR): Not set
        .... .0.. .... = ECN-Echo: Not set
        .... ..0. .... = Urgent: Not set
        .... ...1 .... = Acknowledgment: Set
        .... .... 1... = Push: Set
        .... .... .0.. = Reset: Not set
        .... .... ..0. = Syn: Not set
        .... .... ...0 = Fin: Not set
    Window size value: 4154
    [Calculated window size: 16616]
    [Window size scaling factor: 4]
    Checksum: 0xe9fb [validation disabled]
        [Good Checksum: False]
        [Bad Checksum: False]
    [SEQ/ACK analysis]
        [Bytes in flight: 712]
Hypertext Transfer Protocol
    GET /files/css/css_ad23656066708bcd21f6033ea3dc2ba9.css HTTP/1.1\r\n
        [Expert Info (Chat/Sequence): GET /files/css/css_ad23656066708bcd21f6033ea3dc2ba9.css HTTP/1.1\r\n]
            [Message: GET /files/css/css_ad23656066708bcd21f6033ea3dc2ba9.css HTTP/1.1\r\n]
            [Severity level: Chat]
            [Group: Sequence]
        Request Method: GET
        Request URI: /files/css/css_ad23656066708bcd21f6033ea3dc2ba9.css
        Request Version: HTTP/1.1
    Host: twit.tv\r\n
    Connection: keep-alive\r\n
    Accept: text/css,*/*;q=0.1\r\n
    User-Agent: Mozilla/5.0 (Windows NT 6.3; WOW64) AppleWebKit/537.36 (KHTML, like Gecko) Chrome/32.0.1700.107 Safari/537.36\r\n
    Referer: http://twit.tv/show/futures-in-biotech\r\n
    Accept-Encoding: gzip,deflate,sdch\r\n
    Accept-Language: pt-BR,pt;q=0.8,en-US;q=0.6,en;q=0.4\r\n
    [truncated] Cookie: SESS75d408f2ce389493e4955f4b0d50c557=1cc24ok50gjr23jocea66i99k7; __qca=P0-1987247339-1392382357015; __utma=14346290.60775476.1392382360.1392382360.1392382360.1; __utmz=14346290.1392382360.1.1.utmcsr=(direct)|utmccn=(dir
    \r\n
    [Full request URI: http://twit.tv/files/css/css_ad23656066708bcd21f6033ea3dc2ba9.css]
    [HTTP request 1/1]
    [Response in frame: 1618]

No.     Time           Source                Destination           Protocol Length Info
   1312 9.954359000    192.168.0.70          174.36.55.199         HTTP     748    GET /files/js/js_2ab9cd78560f7e9d177f3103c8c96fb5.js HTTP/1.1 

Frame 1312: 748 bytes on wire (5984 bits), 748 bytes captured (5984 bits) on interface 0
    Interface id: 0
    Encapsulation type: Ethernet (1)
    Arrival Time: Feb 17, 2014 16:08:27.127241000 E. South America Standard Time
    [Time shift for this packet: 0.000000000 seconds]
    Epoch Time: 1392664107.127241000 seconds
    [Time delta from previous captured frame: 0.000734000 seconds]
    [Time delta from previous displayed frame: 0.000734000 seconds]
    [Time since reference or first frame: 9.954359000 seconds]
    Frame Number: 1312
    Frame Length: 748 bytes (5984 bits)
    Capture Length: 748 bytes (5984 bits)
    [Frame is marked: False]
    [Frame is ignored: False]
    [Protocols in frame: eth:ip:tcp:http]
    [Number of per-protocol-data: 1]
    [Hypertext Transfer Protocol, key 0]
    [Coloring Rule Name: HTTP]
    [Coloring Rule String: http || tcp.port == 80]
Ethernet II, Src: Azurewav_69:57:2a (dc:85:de:69:57:2a), Dst: Tp-LinkT_d9:d4:14 (64:66:b3:d9:d4:14)
    Destination: Tp-LinkT_d9:d4:14 (64:66:b3:d9:d4:14)
        Address: Tp-LinkT_d9:d4:14 (64:66:b3:d9:d4:14)
        .... ..0. .... .... .... .... = LG bit: Globally unique address (factory default)
        .... ...0 .... .... .... .... = IG bit: Individual address (unicast)
    Source: Azurewav_69:57:2a (dc:85:de:69:57:2a)
        Address: Azurewav_69:57:2a (dc:85:de:69:57:2a)
        .... ..0. .... .... .... .... = LG bit: Globally unique address (factory default)
        .... ...0 .... .... .... .... = IG bit: Individual address (unicast)
    Type: IP (0x0800)
Internet Protocol Version 4, Src: 192.168.0.70 (192.168.0.70), Dst: 174.36.55.199 (174.36.55.199)
    Version: 4
    Header length: 20 bytes
    Differentiated Services Field: 0x00 (DSCP 0x00: Default; ECN: 0x00: Not-ECT (Not ECN-Capable Transport))
        0000 00.. = Differentiated Services Codepoint: Default (0x00)
        .... ..00 = Explicit Congestion Notification: Not-ECT (Not ECN-Capable Transport) (0x00)
    Total Length: 734
    Identification: 0x7ea3 (32419)
    Flags: 0x02 (Don't Fragment)
        0... .... = Reserved bit: Not set
        .1.. .... = Don't fragment: Set
        ..0. .... = More fragments: Not set
    Fragment offset: 0
    Time to live: 128
    Protocol: TCP (6)
    Header checksum: 0xd29c [correct]
        [Good: True]
        [Bad: False]
    Source: 192.168.0.70 (192.168.0.70)
    Destination: 174.36.55.199 (174.36.55.199)
    [Source GeoIP: Unknown]
    [Destination GeoIP: Unknown]
Transmission Control Protocol, Src Port: 51860 (51860), Dst Port: http (80), Seq: 1, Ack: 1, Len: 694
    Source port: 51860 (51860)
    Destination port: http (80)
    [Stream index: 58]
    Sequence number: 1    (relative sequence number)
    [Next sequence number: 695    (relative sequence number)]
    Acknowledgment number: 1    (relative ack number)
    Header length: 20 bytes
    Flags: 0x018 (PSH, ACK)
        000. .... .... = Reserved: Not set
        ...0 .... .... = Nonce: Not set
        .... 0... .... = Congestion Window Reduced (CWR): Not set
        .... .0.. .... = ECN-Echo: Not set
        .... ..0. .... = Urgent: Not set
        .... ...1 .... = Acknowledgment: Set
        .... .... 1... = Push: Set
        .... .... .0.. = Reset: Not set
        .... .... ..0. = Syn: Not set
        .... .... ...0 = Fin: Not set
    Window size value: 4154
    [Calculated window size: 16616]
    [Window size scaling factor: 4]
    Checksum: 0xaf05 [validation disabled]
        [Good Checksum: False]
        [Bad Checksum: False]
    [SEQ/ACK analysis]
        [Bytes in flight: 694]
Hypertext Transfer Protocol
    GET /files/js/js_2ab9cd78560f7e9d177f3103c8c96fb5.js HTTP/1.1\r\n
        [Expert Info (Chat/Sequence): GET /files/js/js_2ab9cd78560f7e9d177f3103c8c96fb5.js HTTP/1.1\r\n]
            [Message: GET /files/js/js_2ab9cd78560f7e9d177f3103c8c96fb5.js HTTP/1.1\r\n]
            [Severity level: Chat]
            [Group: Sequence]
        Request Method: GET
        Request URI: /files/js/js_2ab9cd78560f7e9d177f3103c8c96fb5.js
        Request Version: HTTP/1.1
    Host: twit.tv\r\n
    Connection: keep-alive\r\n
    Accept: */*\r\n
    User-Agent: Mozilla/5.0 (Windows NT 6.3; WOW64) AppleWebKit/537.36 (KHTML, like Gecko) Chrome/32.0.1700.107 Safari/537.36\r\n
    Referer: http://twit.tv/show/futures-in-biotech\r\n
    Accept-Encoding: gzip,deflate,sdch\r\n
    Accept-Language: pt-BR,pt;q=0.8,en-US;q=0.6,en;q=0.4\r\n
    [truncated] Cookie: SESS75d408f2ce389493e4955f4b0d50c557=1cc24ok50gjr23jocea66i99k7; __qca=P0-1987247339-1392382357015; __utma=14346290.60775476.1392382360.1392382360.1392382360.1; __utmz=14346290.1392382360.1.1.utmcsr=(direct)|utmccn=(dir
    \r\n
    [Full request URI: http://twit.tv/files/js/js_2ab9cd78560f7e9d177f3103c8c96fb5.js]
    [HTTP request 1/1]
    [Response in frame: 1786]

No.     Time           Source                Destination           Protocol Length Info
   1314 9.957165000    192.168.0.70          174.36.55.199         HTTP     766    GET /files/css/css_c7a0d4e0d1aeeb95d86a620257fa29a9.css HTTP/1.1 

Frame 1314: 766 bytes on wire (6128 bits), 766 bytes captured (6128 bits) on interface 0
    Interface id: 0
    Encapsulation type: Ethernet (1)
    Arrival Time: Feb 17, 2014 16:08:27.130047000 E. South America Standard Time
    [Time shift for this packet: 0.000000000 seconds]
    Epoch Time: 1392664107.130047000 seconds
    [Time delta from previous captured frame: 0.002412000 seconds]
    [Time delta from previous displayed frame: 0.002806000 seconds]
    [Time since reference or first frame: 9.957165000 seconds]
    Frame Number: 1314
    Frame Length: 766 bytes (6128 bits)
    Capture Length: 766 bytes (6128 bits)
    [Frame is marked: False]
    [Frame is ignored: False]
    [Protocols in frame: eth:ip:tcp:http]
    [Number of per-protocol-data: 1]
    [Hypertext Transfer Protocol, key 0]
    [Coloring Rule Name: HTTP]
    [Coloring Rule String: http || tcp.port == 80]
Ethernet II, Src: Azurewav_69:57:2a (dc:85:de:69:57:2a), Dst: Tp-LinkT_d9:d4:14 (64:66:b3:d9:d4:14)
    Destination: Tp-LinkT_d9:d4:14 (64:66:b3:d9:d4:14)
        Address: Tp-LinkT_d9:d4:14 (64:66:b3:d9:d4:14)
        .... ..0. .... .... .... .... = LG bit: Globally unique address (factory default)
        .... ...0 .... .... .... .... = IG bit: Individual address (unicast)
    Source: Azurewav_69:57:2a (dc:85:de:69:57:2a)
        Address: Azurewav_69:57:2a (dc:85:de:69:57:2a)
        .... ..0. .... .... .... .... = LG bit: Globally unique address (factory default)
        .... ...0 .... .... .... .... = IG bit: Individual address (unicast)
    Type: IP (0x0800)
Internet Protocol Version 4, Src: 192.168.0.70 (192.168.0.70), Dst: 174.36.55.199 (174.36.55.199)
    Version: 4
    Header length: 20 bytes
    Differentiated Services Field: 0x00 (DSCP 0x00: Default; ECN: 0x00: Not-ECT (Not ECN-Capable Transport))
        0000 00.. = Differentiated Services Codepoint: Default (0x00)
        .... ..00 = Explicit Congestion Notification: Not-ECT (Not ECN-Capable Transport) (0x00)
    Total Length: 752
    Identification: 0x7ea4 (32420)
    Flags: 0x02 (Don't Fragment)
        0... .... = Reserved bit: Not set
        .1.. .... = Don't fragment: Set
        ..0. .... = More fragments: Not set
    Fragment offset: 0
    Time to live: 128
    Protocol: TCP (6)
    Header checksum: 0xd289 [correct]
        [Good: True]
        [Bad: False]
    Source: 192.168.0.70 (192.168.0.70)
    Destination: 174.36.55.199 (174.36.55.199)
    [Source GeoIP: Unknown]
    [Destination GeoIP: Unknown]
Transmission Control Protocol, Src Port: 51859 (51859), Dst Port: http (80), Seq: 1, Ack: 1, Len: 712
    Source port: 51859 (51859)
    Destination port: http (80)
    [Stream index: 57]
    Sequence number: 1    (relative sequence number)
    [Next sequence number: 713    (relative sequence number)]
    Acknowledgment number: 1    (relative ack number)
    Header length: 20 bytes
    Flags: 0x018 (PSH, ACK)
        000. .... .... = Reserved: Not set
        ...0 .... .... = Nonce: Not set
        .... 0... .... = Congestion Window Reduced (CWR): Not set
        .... .0.. .... = ECN-Echo: Not set
        .... ..0. .... = Urgent: Not set
        .... ...1 .... = Acknowledgment: Set
        .... .... 1... = Push: Set
        .... .... .0.. = Reset: Not set
        .... .... ..0. = Syn: Not set
        .... .... ...0 = Fin: Not set
    Window size value: 4154
    [Calculated window size: 16616]
    [Window size scaling factor: 4]
    Checksum: 0xb469 [validation disabled]
        [Good Checksum: False]
        [Bad Checksum: False]
    [SEQ/ACK analysis]
        [Bytes in flight: 712]
Hypertext Transfer Protocol
    GET /files/css/css_c7a0d4e0d1aeeb95d86a620257fa29a9.css HTTP/1.1\r\n
        [Expert Info (Chat/Sequence): GET /files/css/css_c7a0d4e0d1aeeb95d86a620257fa29a9.css HTTP/1.1\r\n]
            [Message: GET /files/css/css_c7a0d4e0d1aeeb95d86a620257fa29a9.css HTTP/1.1\r\n]
            [Severity level: Chat]
            [Group: Sequence]
        Request Method: GET
        Request URI: /files/css/css_c7a0d4e0d1aeeb95d86a620257fa29a9.css
        Request Version: HTTP/1.1
    Host: twit.tv\r\n
    Connection: keep-alive\r\n
    Accept: text/css,*/*;q=0.1\r\n
    User-Agent: Mozilla/5.0 (Windows NT 6.3; WOW64) AppleWebKit/537.36 (KHTML, like Gecko) Chrome/32.0.1700.107 Safari/537.36\r\n
    Referer: http://twit.tv/show/futures-in-biotech\r\n
    Accept-Encoding: gzip,deflate,sdch\r\n
    Accept-Language: pt-BR,pt;q=0.8,en-US;q=0.6,en;q=0.4\r\n
    [truncated] Cookie: SESS75d408f2ce389493e4955f4b0d50c557=1cc24ok50gjr23jocea66i99k7; __qca=P0-1987247339-1392382357015; __utma=14346290.60775476.1392382360.1392382360.1392382360.1; __utmz=14346290.1392382360.1.1.utmcsr=(direct)|utmccn=(dir
    \r\n
    [Full request URI: http://twit.tv/files/css/css_c7a0d4e0d1aeeb95d86a620257fa29a9.css]
    [HTTP request 1/1]
    [Response in frame: 1334]

No.     Time           Source                Destination           Protocol Length Info
   1317 9.974039000    192.168.0.70          69.31.75.240          HTTP     412    GET /js/s_code.js HTTP/1.1 

Frame 1317: 412 bytes on wire (3296 bits), 412 bytes captured (3296 bits) on interface 0
    Interface id: 0
    Encapsulation type: Ethernet (1)
    Arrival Time: Feb 17, 2014 16:08:27.146921000 E. South America Standard Time
    [Time shift for this packet: 0.000000000 seconds]
    Epoch Time: 1392664107.146921000 seconds
    [Time delta from previous captured frame: 0.010023000 seconds]
    [Time delta from previous displayed frame: 0.016874000 seconds]
    [Time since reference or first frame: 9.974039000 seconds]
    Frame Number: 1317
    Frame Length: 412 bytes (3296 bits)
    Capture Length: 412 bytes (3296 bits)
    [Frame is marked: False]
    [Frame is ignored: False]
    [Protocols in frame: eth:ip:tcp:http]
    [Number of per-protocol-data: 1]
    [Hypertext Transfer Protocol, key 0]
    [Coloring Rule Name: HTTP]
    [Coloring Rule String: http || tcp.port == 80]
Ethernet II, Src: Azurewav_69:57:2a (dc:85:de:69:57:2a), Dst: Tp-LinkT_d9:d4:14 (64:66:b3:d9:d4:14)
    Destination: Tp-LinkT_d9:d4:14 (64:66:b3:d9:d4:14)
        Address: Tp-LinkT_d9:d4:14 (64:66:b3:d9:d4:14)
        .... ..0. .... .... .... .... = LG bit: Globally unique address (factory default)
        .... ...0 .... .... .... .... = IG bit: Individual address (unicast)
    Source: Azurewav_69:57:2a (dc:85:de:69:57:2a)
        Address: Azurewav_69:57:2a (dc:85:de:69:57:2a)
        .... ..0. .... .... .... .... = LG bit: Globally unique address (factory default)
        .... ...0 .... .... .... .... = IG bit: Individual address (unicast)
    Type: IP (0x0800)
Internet Protocol Version 4, Src: 192.168.0.70 (192.168.0.70), Dst: 69.31.75.240 (69.31.75.240)
    Version: 4
    Header length: 20 bytes
    Differentiated Services Field: 0x00 (DSCP 0x00: Default; ECN: 0x00: Not-ECT (Not ECN-Capable Transport))
        0000 00.. = Differentiated Services Codepoint: Default (0x00)
        .... ..00 = Explicit Congestion Notification: Not-ECT (Not ECN-Capable Transport) (0x00)
    Total Length: 398
    Identification: 0x43cd (17357)
    Flags: 0x02 (Don't Fragment)
        0... .... = Reserved bit: Not set
        .1.. .... = Don't fragment: Set
        ..0. .... = More fragments: Not set
    Fragment offset: 0
    Time to live: 128
    Protocol: TCP (6)
    Header checksum: 0x639f [correct]
        [Good: True]
        [Bad: False]
    Source: 192.168.0.70 (192.168.0.70)
    Destination: 69.31.75.240 (69.31.75.240)
    [Source GeoIP: Unknown]
    [Destination GeoIP: Unknown]
Transmission Control Protocol, Src Port: 51864 (51864), Dst Port: http (80), Seq: 1, Ack: 1, Len: 358
    Source port: 51864 (51864)
    Destination port: http (80)
    [Stream index: 61]
    Sequence number: 1    (relative sequence number)
    [Next sequence number: 359    (relative sequence number)]
    Acknowledgment number: 1    (relative ack number)
    Header length: 20 bytes
    Flags: 0x018 (PSH, ACK)
        000. .... .... = Reserved: Not set
        ...0 .... .... = Nonce: Not set
        .... 0... .... = Congestion Window Reduced (CWR): Not set
        .... .0.. .... = ECN-Echo: Not set
        .... ..0. .... = Urgent: Not set
        .... ...1 .... = Acknowledgment: Set
        .... .... 1... = Push: Set
        .... .... .0.. = Reset: Not set
        .... .... ..0. = Syn: Not set
        .... .... ...0 = Fin: Not set
    Window size value: 4154
    [Calculated window size: 16616]
    [Window size scaling factor: 4]
    Checksum: 0x44ad [validation disabled]
        [Good Checksum: False]
        [Bad Checksum: False]
    [SEQ/ACK analysis]
        [Bytes in flight: 358]
Hypertext Transfer Protocol
    GET /js/s_code.js HTTP/1.1\r\n
        [Expert Info (Chat/Sequence): GET /js/s_code.js HTTP/1.1\r\n]
            [Message: GET /js/s_code.js HTTP/1.1\r\n]
            [Severity level: Chat]
            [Group: Sequence]
        Request Method: GET
        Request URI: /js/s_code.js
        Request Version: HTTP/1.1
    Host: common.prndigital.com\r\n
    Connection: keep-alive\r\n
    Accept: */*\r\n
    User-Agent: Mozilla/5.0 (Windows NT 6.3; WOW64) AppleWebKit/537.36 (KHTML, like Gecko) Chrome/32.0.1700.107 Safari/537.36\r\n
    Referer: http://twit.tv/show/futures-in-biotech\r\n
    Accept-Encoding: gzip,deflate,sdch\r\n
    Accept-Language: pt-BR,pt;q=0.8,en-US;q=0.6,en;q=0.4\r\n
    \r\n
    [Full request URI: http://common.prndigital.com/js/s_code.js]
    [HTTP request 1/1]
    [Response in frame: 1432]

No.     Time           Source                Destination           Protocol Length Info
   1321 10.202093000   192.168.0.70          72.21.91.110          HTTP     413    GET /js/srkkdods.js HTTP/1.1 

Frame 1321: 413 bytes on wire (3304 bits), 413 bytes captured (3304 bits) on interface 0
    Interface id: 0
    Encapsulation type: Ethernet (1)
    Arrival Time: Feb 17, 2014 16:08:27.374975000 E. South America Standard Time
    [Time shift for this packet: 0.000000000 seconds]
    Epoch Time: 1392664107.374975000 seconds
    [Time delta from previous captured frame: 0.068705000 seconds]
    [Time delta from previous displayed frame: 0.228054000 seconds]
    [Time since reference or first frame: 10.202093000 seconds]
    Frame Number: 1321
    Frame Length: 413 bytes (3304 bits)
    Capture Length: 413 bytes (3304 bits)
    [Frame is marked: False]
    [Frame is ignored: False]
    [Protocols in frame: eth:ip:tcp:http]
    [Number of per-protocol-data: 1]
    [Hypertext Transfer Protocol, key 0]
    [Coloring Rule Name: HTTP]
    [Coloring Rule String: http || tcp.port == 80]
Ethernet II, Src: Azurewav_69:57:2a (dc:85:de:69:57:2a), Dst: Tp-LinkT_d9:d4:14 (64:66:b3:d9:d4:14)
    Destination: Tp-LinkT_d9:d4:14 (64:66:b3:d9:d4:14)
        Address: Tp-LinkT_d9:d4:14 (64:66:b3:d9:d4:14)
        .... ..0. .... .... .... .... = LG bit: Globally unique address (factory default)
        .... ...0 .... .... .... .... = IG bit: Individual address (unicast)
    Source: Azurewav_69:57:2a (dc:85:de:69:57:2a)
        Address: Azurewav_69:57:2a (dc:85:de:69:57:2a)
        .... ..0. .... .... .... .... = LG bit: Globally unique address (factory default)
        .... ...0 .... .... .... .... = IG bit: Individual address (unicast)
    Type: IP (0x0800)
Internet Protocol Version 4, Src: 192.168.0.70 (192.168.0.70), Dst: 72.21.91.110 (72.21.91.110)
    Version: 4
    Header length: 20 bytes
    Differentiated Services Field: 0x00 (DSCP 0x00: Default; ECN: 0x00: Not-ECT (Not ECN-Capable Transport))
        0000 00.. = Differentiated Services Codepoint: Default (0x00)
        .... ..00 = Explicit Congestion Notification: Not-ECT (Not ECN-Capable Transport) (0x00)
    Total Length: 399
    Identification: 0x64be (25790)
    Flags: 0x02 (Don't Fragment)
        0... .... = Reserved bit: Not set
        .1.. .... = Don't fragment: Set
        ..0. .... = More fragments: Not set
    Fragment offset: 0
    Time to live: 128
    Protocol: TCP (6)
    Header checksum: 0x3039 [correct]
        [Good: True]
        [Bad: False]
    Source: 192.168.0.70 (192.168.0.70)
    Destination: 72.21.91.110 (72.21.91.110)
    [Source GeoIP: Unknown]
    [Destination GeoIP: Unknown]
Transmission Control Protocol, Src Port: 51842 (51842), Dst Port: http (80), Seq: 1, Ack: 1, Len: 359
    Source port: 51842 (51842)
    Destination port: http (80)
    [Stream index: 50]
    Sequence number: 1    (relative sequence number)
    [Next sequence number: 360    (relative sequence number)]
    Acknowledgment number: 1    (relative ack number)
    Header length: 20 bytes
    Flags: 0x018 (PSH, ACK)
        000. .... .... = Reserved: Not set
        ...0 .... .... = Nonce: Not set
        .... 0... .... = Congestion Window Reduced (CWR): Not set
        .... .0.. .... = ECN-Echo: Not set
        .... ..0. .... = Urgent: Not set
        .... ...1 .... = Acknowledgment: Set
        .... .... 1... = Push: Set
        .... .... .0.. = Reset: Not set
        .... .... ..0. = Syn: Not set
        .... .... ...0 = Fin: Not set
    Window size value: 4154
    [Calculated window size: 16616]
    [Window size scaling factor: 4]
    Checksum: 0x2044 [validation disabled]
        [Good Checksum: False]
        [Bad Checksum: False]
    [SEQ/ACK analysis]
        [Bytes in flight: 359]
Hypertext Transfer Protocol
    GET /js/srkkdods.js HTTP/1.1\r\n
        [Expert Info (Chat/Sequence): GET /js/srkkdods.js HTTP/1.1\r\n]
            [Message: GET /js/srkkdods.js HTTP/1.1\r\n]
            [Severity level: Chat]
            [Group: Sequence]
        Request Method: GET
        Request URI: /js/srkkdods.js
        Request Version: HTTP/1.1
    Host: cdn.sublimevideo.net\r\n
    Connection: keep-alive\r\n
    Accept: */*\r\n
    User-Agent: Mozilla/5.0 (Windows NT 6.3; WOW64) AppleWebKit/537.36 (KHTML, like Gecko) Chrome/32.0.1700.107 Safari/537.36\r\n
    Referer: http://twit.tv/show/futures-in-biotech\r\n
    Accept-Encoding: gzip,deflate,sdch\r\n
    Accept-Language: pt-BR,pt;q=0.8,en-US;q=0.6,en;q=0.4\r\n
    \r\n
    [Full request URI: http://cdn.sublimevideo.net/js/srkkdods.js]
    [HTTP request 1/1]
    [Response in frame: 1388]

No.     Time           Source                Destination           Protocol Length Info
   1346 10.358690000   192.168.0.70          174.36.55.199         HTTP     767    GET /files/imagecache/flyout-icon/coverart/twit600.jpg HTTP/1.1 

